{
  "formation_version": "1.0.0",
  "pass": "question_discovery",
  "questions": [
    {
      "id": "Q.A01.S01",
      "question": "当前组织属于须备案主体、暂无备案要求的主体，还是个体工商户，依据哪个适用时点和主体类型判断？",
      "topic": "备案范围",
      "consumer": "备案经办与登记机关",
      "decision_use": "决定是否启动备案及范围外原因",
      "unknown_policy": "主体类型或现行范围缺证时不作免备案结论，调取有效登记资料与当前规定。"
    },
    {
      "id": "Q.A01.S02",
      "question": "注册资本或出资额恰为1000万元、折算为等值外币时，承诺免报的金额条件如何核对？",
      "topic": "备案范围",
      "consumer": "备案经办与登记机关",
      "decision_use": "决定金额边界是否满足",
      "unknown_policy": "金额、币种或折算依据缺失则不适用免报承诺。"
    },
    {
      "id": "Q.A01.S03",
      "question": "全部股东或合伙人都是自然人，且名义自然人与真实控制、获益者一致的证据是否充分？",
      "topic": "备案范围",
      "consumer": "备案经办与登记机关",
      "decision_use": "核对承诺免报的自然人条件",
      "unknown_policy": "股东身份、代持和外部控制仍存疑时不得按已符合处理。"
    },
    {
      "id": "Q.A01.S04",
      "question": "是否存在股东或合伙人以外的自然人实际控制、取得收益，从而使承诺免报失效？",
      "topic": "备案范围",
      "consumer": "备案经办与登记机关",
      "decision_use": "决定承诺免报的外部自然人条件",
      "unknown_policy": "仅无登记股东线索不等于没有外部控制，缺协议及权利材料即待核。"
    },
    {
      "id": "Q.A01.S05",
      "question": "是否存在通过股权或合伙权益以外方式实施控制或获取收益，从而不能承诺免报？",
      "topic": "备案范围",
      "consumer": "备案经办与登记机关",
      "decision_use": "决定承诺免报的非股权条件",
      "unknown_policy": "非股权安排未核清不得承诺全部条件已满足。"
    },
    {
      "id": "Q.A01.S07",
      "question": "新设登记、无法通过系统设立登记、实施前存量主体，各自何时完成备案？",
      "topic": "备案时限",
      "consumer": "备案经办与登记机关",
      "decision_use": "分别计算初始备案时限",
      "unknown_policy": "设立日期或有无现场办理不明时保留待核；无正式延期文件不擅改期限。"
    },
    {
      "id": "Q.A01.S08",
      "question": "受益所有人信息变动与承诺免报条件丧失，各自从何事实日期起计算30日更新？",
      "topic": "备案时限",
      "consumer": "备案经办与登记机关",
      "decision_use": "确定备案更新触发及截止日",
      "unknown_policy": "变化生效日缺证时不臆定登记日，发起补充确认。"
    },
    {
      "id": "Q.A01.S09",
      "question": "备案的自然人身份字段及地址、联系方式、证件有效期如何逐人核对？",
      "topic": "备案信息",
      "consumer": "备案经办与登记机关",
      "decision_use": "防止漏填错填身份要素",
      "unknown_policy": "身份文件不足或相互冲突时暂不声明准确，要求可靠文件。"
    },
    {
      "id": "Q.A01.S10",
      "question": "受益所有权关系类型、形成及终止日期应如何逐项记载？",
      "topic": "备案信息",
      "consumer": "备案经办与登记机关",
      "decision_use": "形成按人按权利的备案记录",
      "unknown_policy": "关系起止日期无有效来源时注明未知及待补材料。"
    },
    {
      "id": "Q.A01.S12",
      "question": "备案主体识别与金融机构客户识别是否面对同一对象、作同一个判断、由谁承担各自核实责任？",
      "topic": "适用口径",
      "consumer": "备案经办与金融机构客户尽调人员",
      "decision_use": "区分备案、自行识别与BOMIS核对",
      "unknown_policy": "只取得备案结论时机构识别仍未完成，分别标未核。"
    },
    {
      "id": "Q.A01.S13",
      "question": "自然人直接持有多少股权、股份或合伙权益才达到标准，恰为25%是否包括？",
      "topic": "权益持有",
      "consumer": "备案经办与金融机构客户尽调人员",
      "decision_use": "判定直接权益阈值",
      "unknown_policy": "持股比例、权益类型或自然人身份缺证时只记候选。"
    },
    {
      "id": "Q.A01.S14",
      "question": "间接持股经过哪些有效上层主体和路径，如何逐路径计算同一自然人最终拥有比例并汇总？",
      "topic": "权益持有",
      "consumer": "备案经办与金融机构客户尽调人员",
      "decision_use": "判定间接持有和多路径合计",
      "unknown_policy": "任一关键链路比例或时点缺失则不能推定整体阈值。"
    },
    {
      "id": "Q.A01.S16",
      "question": "登记持股与代持、受益权转移不一致时，登记股东是否仍为最终拥有者、实际权益归属谁？",
      "topic": "权益持有",
      "consumer": "备案经办与金融机构客户尽调人员",
      "decision_use": "阻止名义股东误判",
      "unknown_policy": "协议当事人及权利生效缺证时登记人与被代持人均作待核候选。"
    },
    {
      "id": "Q.A01.S17",
      "question": "自然人未满足持有权益标准，却最终享有多少收益权，是否达到25%，收益权从何而来？",
      "topic": "收益表决",
      "consumer": "备案经办与金融机构客户尽调人员",
      "decision_use": "判断收益权路径",
      "unknown_policy": "股息或单次付款不自动证明最终收益权，需协议及比例。"
    },
    {
      "id": "Q.A01.S18",
      "question": "自然人未满足持有权益标准，却最终享有多少表决权，委托或一致行动的范围、期限是否支持25%以上？",
      "topic": "收益表决",
      "consumer": "备案经办与金融机构客户尽调人员",
      "decision_use": "判断表决权路径",
      "unknown_policy": "缺有效授权或实际可行使范围时不凭表面投票权占比认定。"
    },
    {
      "id": "Q.A01.S20",
      "question": "同一自然人已满足持股标准时，另有收益、表决或控制事实应如何处理，何时仍须同时标注标准二与三？",
      "topic": "标准顺序",
      "consumer": "备案经办与金融机构客户尽调人员",
      "decision_use": "区分同一人标准适用、事实留存和多关系备案",
      "unknown_policy": "标准一是否已满足不清时保留各权利事实，不做强制优先归类。"
    },
    {
      "id": "Q.A01.S21",
      "question": "控制权来自哪份协议、代持、一致行动、亲密关系或其他安排，其法律权限及实际行使是否足以控制客户？",
      "topic": "实际控制",
      "consumer": "备案经办与金融机构客户尽调人员",
      "decision_use": "判断实际控制来源及充分性",
      "unknown_policy": "仅关系密切、签约或第三方标签不足以断言实施控制，须补权利和行使证据。"
    },
    {
      "id": "Q.A01.S22",
      "question": "谁能够决定法定代表人、董事、监事、高管或执行事务合伙人任免，实际决定权和普通任职如何区分？",
      "topic": "实际控制",
      "consumer": "备案经办与金融机构客户尽调人员",
      "decision_use": "核实人事任免控制",
      "unknown_policy": "仅法定代表人或董事头衔不充分，需任免安排及决定记录。"
    },
    {
      "id": "Q.A01.S23",
      "question": "谁决定重大经营管理决策的制定或执行，决议权、否决权及实际决策记录是否支持结论？",
      "topic": "实际控制",
      "consumer": "备案经办与金融机构客户尽调人员",
      "decision_use": "核实经营管理决策控制",
      "unknown_policy": "无具体权限和决定过程时只记候选，不能以投资关系推断。"
    },
    {
      "id": "Q.A01.S24",
      "question": "谁实际决定财务收支，与仅经办、签字或授权付款的人员有何区别？",
      "topic": "实际控制",
      "consumer": "备案经办与金融机构客户尽调人员",
      "decision_use": "核实财务控制",
      "unknown_policy": "资金流水或财务职位不自动证明最终决定权，须补治理授权。"
    },
    {
      "id": "Q.A01.S25",
      "question": "谁长期实际支配重要资产或主要资金，资产重要性、支配持续性和受益所有权之间如何核实？",
      "topic": "实际控制",
      "consumer": "备案经办与金融机构客户尽调人员",
      "decision_use": "核实资产资金支配控制",
      "unknown_policy": "一次性交易或资产使用不能推断长期支配，未证持续性保持未知。"
    },
    {
      "id": "Q.A01.S26",
      "question": "多个自然人是否通过同一协议或行为联合实施实际控制，每人控制权限和共同作用是什么？",
      "topic": "实际控制",
      "consumer": "备案经办与金融机构客户尽调人员",
      "decision_use": "核实联合控制与各自然人身份",
      "unknown_policy": "仅共同持股或亲属关系不足以确认联合决定，补协议及实际行动。"
    },
    {
      "id": "Q.A01.S27",
      "question": "公司法或国资交易语境的实际控制企业、披露的实际控制人，与本次须识别的自然人受益所有人如何区分？",
      "topic": "实际控制",
      "consumer": "备案经办与金融机构客户尽调人员",
      "decision_use": "阻止不同法律口径及法人控制者互相替代",
      "unknown_policy": "披露人未核身份、期间与权利时仅作候选，国资资格不推自然人。"
    },
    {
      "id": "Q.A01.S28",
      "question": "何时可以证实三项自然人识别标准均不存在，才能启用负责日常经营管理人员的备位识别？",
      "topic": "兜底识别",
      "consumer": "备案经办与金融机构客户尽调人员",
      "decision_use": "确定备位识别前提",
      "unknown_policy": "无法取得控制协议不等于证明不存在控制，不得自动走备位。"
    },
    {
      "id": "Q.A01.S29",
      "question": "启用备位后谁实际负责日常经营管理，法定代表人、董事长、经理中应如何选择并核对任职？",
      "topic": "兜底识别",
      "consumer": "备案经办与金融机构客户尽调人员",
      "decision_use": "确定备位人员及证明",
      "unknown_policy": "只知名义职位无实际职责、任职文件时暂不确定备位人。"
    },
    {
      "id": "Q.A01.S30",
      "question": "国有独资、国有控股与仅国有参股如何以官方登记及实际股权/控制资料区分？",
      "topic": "国资识别",
      "consumer": "备案经办与金融机构客户尽调人员",
      "decision_use": "选择国资特定识别或一般识别",
      "unknown_policy": "仅国企自称、股东名称或第三方标签不足，官方资料冲突时暂停简化。"
    },
    {
      "id": "Q.A01.S31",
      "question": "备案中国有独资或控股公司法定代表人视同，金融机构识别中相应简化路径，各自是否可采用且需要哪些风险前提？",
      "topic": "国资识别",
      "consumer": "备案经办与金融机构客户尽调人员",
      "decision_use": "分别决定备案与机构简化适用",
      "unknown_policy": "国资身份或机构风险判断未证实时不可一概套用法代路径。"
    },
    {
      "id": "Q.A01.S32",
      "question": "国有参股公司国有资本路径能否停止向自然人穿透，其余社会资本及非股权控制是否仍须识别？",
      "topic": "国资识别",
      "consumer": "备案经办与金融机构客户尽调人员",
      "decision_use": "限定国资部分例外的穿透范围",
      "unknown_policy": "无持股路径及出资人属性证据时不能扩展豁免至全部股东。"
    },
    {
      "id": "Q.A01.S33",
      "question": "国内法人或非法人组织分支机构如何识别所属主体，何时通常承继其受益所有人，既有尽调资料何时可复用？",
      "topic": "分支机构",
      "consumer": "备案经办与金融机构客户尽调人员",
      "decision_use": "国内分支机构识别与既有信息复用",
      "unknown_policy": "总分关系或既有尽调未核实则不得仅凭名称沿用。"
    },
    {
      "id": "Q.A01.S34",
      "question": "外国公司分支机构需如何同时识别所属外国公司自然人受益所有人与至少一名分支高管，并区别备案和机构识别？",
      "topic": "分支机构",
      "consumer": "备案经办与金融机构客户尽调人员",
      "decision_use": "确定外国分支机构双路径识别",
      "unknown_policy": "外国公司资料或分支任职缺证时保留两条路径各自缺口。"
    },
    {
      "id": "Q.A01.S35",
      "question": "所属总公司注销或工商资料缺失总分关系时，能否认定某人代替受益所有人，应补哪些存续和控制证据？",
      "topic": "分支机构",
      "consumer": "备案经办与金融机构客户尽调人员",
      "decision_use": "澄清二次产品兜底说法的适用性",
      "unknown_policy": "仅注销或缺映射不能自动推出分支负责人，要求补官方关系及现时权利证据。"
    },
    {
      "id": "Q.A01.S36",
      "question": "总公司强制注销、恢复登记与分支机构仍登记存续的不同时间状态下，能否沿用原所属关系和受益所有人？",
      "topic": "分支机构",
      "consumer": "备案经办与金融机构客户尽调人员",
      "decision_use": "防止把主体复活直接等同权利复活",
      "unknown_policy": "恢复登记只确定主体登记状态，旧受益权利须独立核生效与延续。"
    },
    {
      "id": "Q.A01.S37",
      "question": "信托委托人、受托人、受益人、监察人及其他最终有效控制自然人分别是谁？",
      "topic": "信托识别",
      "consumer": "金融机构客户尽调与合规人员",
      "decision_use": "确定信托的受益所有人类别",
      "unknown_policy": "未列明受益人时记录范围及其他控制人待核，不编具体自然人。"
    },
    {
      "id": "Q.A01.S38",
      "question": "某信托当事人为非自然人时，如何逐一逐层追溯到最终有效控制该信托的自然人？",
      "topic": "信托识别",
      "consumer": "金融机构客户尽调与合规人员",
      "decision_use": "穿透非自然人信托当事人",
      "unknown_policy": "层级事实或控制事实缺证则保留该分支未证实，不能只停在法人。"
    },
    {
      "id": "Q.A01.S39",
      "question": "处分信托财产、决定投资分配、变更受益人或受托人等不同权限谁最终行使，如何识别其他最终有效控制人？",
      "topic": "信托识别",
      "consumer": "金融机构客户尽调与合规人员",
      "decision_use": "核实信托各控制权分支",
      "unknown_policy": "仅顾问或业务经办身份不充分，核对信托文件和权力行使记录。"
    },
    {
      "id": "Q.A01.S40",
      "question": "信托设立时或存续期间没有明确具体受益人时，受益人范围如何识别记录，后来被指定时如何更新？",
      "topic": "信托识别",
      "consumer": "金融机构客户尽调与合规人员",
      "decision_use": "处理受益人范围与变更",
      "unknown_policy": "不得虚构待指定受益人，保留指定条件和触发时点。"
    },
    {
      "id": "Q.A01.S41",
      "question": "财富管理、公益慈善、其他资产服务、民事与外国信托分别适用何种识别深度和简化条件？",
      "topic": "信托识别",
      "consumer": "金融机构客户尽调与合规人员",
      "decision_use": "区分信托产品类别与服务关系",
      "unknown_policy": "信托类别或低风险不明时不援引简化路径。"
    },
    {
      "id": "Q.A01.S42",
      "question": "受托信托公司提供受益所有人资料时，合作机构何时可以采信，发现疑点、拒不配合或系统性缺陷如何升级？",
      "topic": "信托识别",
      "consumer": "金融机构客户尽调与合规人员",
      "decision_use": "界定跨机构采信与风险管理责任",
      "unknown_policy": "信托公司体系有效性缺证时不可直接外包识别责任。"
    },
    {
      "id": "Q.A01.S43",
      "question": "资产管理信托与其他资管产品如何按所有权控制结构和风险参照法人标准识别？",
      "topic": "资管产品",
      "consumer": "金融机构客户尽调与合规人员",
      "decision_use": "确定资管产品的自然人受益所有人",
      "unknown_policy": "产品份额与管理权限资料不齐时须补证，而非径认管理人。"
    },
    {
      "id": "Q.A01.S44",
      "question": "公开募集且依法备案或登记的资管产品、低风险非公开产品，分别何时可简化认定管理产品的自然人？",
      "topic": "资管产品",
      "consumer": "金融机构客户尽调与合规人员",